5.0,I like this,2024-05-11T23:37:22.545065
4.0,This is not nice,2024-05-11T23:37:22.545114
0.0,I like this,2024-05-11T23:37:22.545142
2.5,This is another comment,2024-05-11T23:37:22.545156
0.5,This is a fourth comment,2024-05-11T23:37:22.545170
1.0,This is not nice,2024-05-11T23:37:22.545183
0.0,This is a comment,2024-05-11T23:37:22.545194
3.5,This is another comment,2024-05-11T23:37:22.545205
2.5,This is nice,2024-05-11T23:37:22.545215
5.0,This is a third comment,2024-05-11T23:37:22.545226
